setCode,name,rarity,manaCost,colorIdentity,types,subtypes,power,toughness,quantity,nm,lp,p,foil,text
KHM,Faceless Haven,rare,0,0,Land,0,0,0,0,0,0,0,0,{T}: Add {C}.\n{S}{S}{S}: Faceless Haven becomes a 4/3 creature with vigilance and all creature types until end of turn. It's still a land. ({S} can be paid with one mana from a snow source.)
KHM,Gates of Istfell,uncommon,0,"U, W",Land,0,0,0,0,0,0,0,0,"Gates of Istfell enters the battlefield tapped.\n{T}: Add {W}.\n{2}{W}{U}{U}, {T}, Sacrifice Gates of Istfell: You gain 2 life and draw two cards."
KHM,Glacial Floodplain,common,0,"U, W",Land,"Plains, Island",0,0,0,0,0,0,0,({T}: Add {W} or {U}.)\nGlacial Floodplain enters the battlefield tapped.
KHM,Gnottvold Slumbermound,uncommon,0,"G, R",Land,0,0,0,0,0,0,0,0,"Gnottvold Slumbermound enters the battlefield tapped.\n{T}: Add {R}.\n{3}{R}{G}{G}, {T}, Sacrifice Gnottvold Slumbermound: Destroy target land. Create a 4/4 green Troll Warrior creature token with trample."
KHM,Great Hall of Starnheim,uncommon,0,"B, W",Land,0,0,0,0,0,0,0,0,"Great Hall of Starnheim enters the battlefield tapped.\n{T}: Add {B}.\n{W}{W}{B}, {T}, Sacrifice Great Hall of Starnheim and a creature you control: Create a 4/4 white Angel Warrior creature token with flying and vigilance. Activate only as a sorcery."
KHM,Hengegate Pathway // Mistgate Pathway,rare,0,"U, W",Land,0,0,0,0,0,0,0,0,{T}: Add {W}.
KHM,Hengegate Pathway // Mistgate Pathway,rare,0,"U, W",Land,0,0,0,0,0,0,0,0,{T}: Add {U}.
KHM,Highland Forest,common,0,"G, R",Land,"Mountain, Forest",0,0,0,0,0,0,0,({T}: Add {R} or {G}.)\nHighland Forest enters the battlefield tapped.
KHM,Ice Tunnel,common,0,"B, U",Land,"Island, Swamp",0,0,0,0,0,0,0,({T}: Add {U} or {B}.)\nIce Tunnel enters the battlefield tapped.
KHM,Immersturm Skullcairn,uncommon,0,"B, R",Land,0,0,0,0,0,0,0,0,"Immersturm Skullcairn enters the battlefield tapped.\n{T}: Add {B}.\n{1}{B}{R}{R}, {T}, Sacrifice Immersturm Skullcairn: It deals 3 damage to target player. That player discards a card. Activate only as a sorcery."
KHM,Littjara Mirrorlake,uncommon,0,"G, U",Land,0,0,0,0,0,0,0,0,"Littjara Mirrorlake enters the battlefield tapped.\n{T}: Add {U}.\n{2}{G}{G}{U}, {T}, Sacrifice Littjara Mirrorlake: Create a token that's a copy of target creature you control, except it enters the battlefield with an additional +1/+1 counter on it. Activate only as a sorcery."
KHM,Port of Karfell,uncommon,0,"B, U",Land,0,0,0,0,0,0,0,0,"Port of Karfell enters the battlefield tapped.\n{T}: Add {U}.\n{3}{U}{B}{B}, {T}, Sacrifice Port of Karfell: Mill four cards, then return a creature card from your graveyard to the battlefield tapped. (To mill a card, put the top card of your library into your graveyard.)"
KHM,Rimewood Falls,common,0,"G, U",Land,"Forest, Island",0,0,0,0,0,0,0,({T}: Add {G} or {U}.)\nRimewood Falls enters the battlefield tapped.
KHM,Shimmerdrift Vale,common,0,0,Land,0,0,0,0,0,0,0,0,"Shimmerdrift Vale enters the battlefield tapped.\nAs Shimmerdrift Vale enters the battlefield, choose a color.\n{T}: Add one mana of the chosen color."
KHM,Skemfar Elderhall,uncommon,0,"B, G",Land,0,0,0,0,0,0,0,0,"Skemfar Elderhall enters the battlefield tapped.\n{T}: Add {G}.\n{2}{B}{B}{G}, {T}, Sacrifice Skemfar Elderhall: Up to one target creature you don't control gets -2/-2 until end of turn. Create two 1/1 green Elf Warrior creature tokens. Activate only as a sorcery."
KHM,A-Skemfar Elderhall,uncommon,0,"B, G",Land,0,0,0,0,0,0,0,0,"Skemfar Elderhall enters the battlefield tapped.\n{T}: Add {G}.\n{1}{B}{B}{G}, {T}, Sacrifice Skemfar Elderhall: Up to one target creature you don't control gets -2/-2 until end of turn. Create two 1/1 green Elf Warrior creature tokens. Activate only as a sorcery."
KHM,Snowfield Sinkhole,common,0,"B, W",Land,"Plains, Swamp",0,0,0,0,0,0,0,({T}: Add {W} or {B}.)\nSnowfield Sinkhole enters the battlefield tapped.
KHM,Sulfurous Mire,common,0,"B, R",Land,"Swamp, Mountain",0,0,0,0,0,0,0,({T}: Add {B} or {R}.)\nSulfurous Mire enters the battlefield tapped.
KHM,Surtland Frostpyre,uncommon,0,"R, U",Land,0,0,0,0,0,0,0,0,"Surtland Frostpyre enters the battlefield tapped.\n{T}: Add {R}.\n{2}{U}{U}{R}, {T}, Sacrifice Surtland Frostpyre: Scry 2. Surtland Frostpyre deals 2 damage to each creature. Activate only as a sorcery."
KHM,Tyrite Sanctum,rare,0,0,Land,0,0,0,0,0,0,0,0,"{T}: Add {C}.\n{2}, {T}: Target legendary creature becomes a God in addition to its other types. Put a +1/+1 counter on it.\n{4}, {T}, Sacrifice Tyrite Sanctum: Put an indestructible counter on target God."
KHM,Volatile Fjord,common,0,"R, U",Land,"Island, Mountain",0,0,0,0,0,0,0,({T}: Add {U} or {R}.)\nVolatile Fjord enters the battlefield tapped.
KHM,Woodland Chasm,common,0,"B, G",Land,"Swamp, Forest",0,0,0,0,0,0,0,({T}: Add {B} or {G}.)\nWoodland Chasm enters the battlefield tapped.
KHM,The World Tree,rare,0,"B, G, R, U, W",Land,0,0,0,0,0,0,0,0,"The World Tree enters the battlefield tapped.\n{T}: Add {G}.\nAs long as you control six or more lands, lands you control have ""{T}: Add one mana of any color.""\n{W}{W}{U}{U}{B}{B}{R}{R}{G}{G}, {T}, Sacrifice The World Tree: Search your library for any number of God cards, put them onto the battlefield, then shuffle."
KHM,Snow-Covered Plains,common,0,W,Land,Plains,0,0,0,0,0,0,0,({T}: Add {W}.)
KHM,Snow-Covered Plains,common,0,W,Land,Plains,0,0,0,0,0,0,0,({T}: Add {W}.)
KHM,Snow-Covered Island,common,0,U,Land,Island,0,0,0,0,0,0,0,({T}: Add {U}.)
KHM,Snow-Covered Island,common,0,U,Land,Island,0,0,0,0,0,0,0,({T}: Add {U}.)
KHM,Snow-Covered Swamp,common,0,B,Land,Swamp,0,0,0,0,0,0,0,({T}: Add {B}.)
KHM,Snow-Covered Swamp,common,0,B,Land,Swamp,0,0,0,0,0,0,0,({T}: Add {B}.)
KHM,Snow-Covered Mountain,common,0,R,Land,Mountain,0,0,0,0,0,0,0,({T}: Add {R}.)
KHM,Snow-Covered Mountain,common,0,R,Land,Mountain,0,0,0,0,0,0,0,({T}: Add {R}.)
KHM,Snow-Covered Forest,common,0,G,Land,Forest,0,0,0,0,0,0,0,({T}: Add {G}.)
KHM,Snow-Covered Forest,common,0,G,Land,Forest,0,0,0,0,0,0,0,({T}: Add {G}.)
KHM,"Valki, God of Lies // Tibalt, Cosmic Impostor",mythic,{1}{B},"B, R",Creature,God,2,1,0,0,0,0,0,"When Valki enters the battlefield, each opponent reveals their hand. For each opponent, exile a creature card they revealed this way until Valki leaves the battlefield.\n{X}: Choose a creature card exiled with Valki with mana value X. Valki becomes a copy of that card."
KHM,"Valki, God of Lies // Tibalt, Cosmic Impostor",mythic,{5}{B}{R},"B, R",Planeswalker,Tibalt,0,0,0,0,0,0,0,"As Tibalt enters the battlefield, you get an emblem with ""You may play cards exiled with Tibalt, Cosmic Impostor, and you may spend mana as though it were mana of any color to cast those spells.""\n[+2]: Exile the top card of each player's library.\n[−3]: Exile target artifact or creature.\n[−8]: Exile all graveyards. Add {R}{R}{R}."
KHM,Tyvar Kell,mythic,{2}{G}{G},"B, G",Planeswalker,Tyvar,0,0,0,0,0,0,0,"Elves you control have ""{T}: Add {B}.""\n[+1]: Put a +1/+1 counter on up to one target Elf. Untap it. It gains deathtouch until end of turn.\n[0]: Create a 1/1 green Elf Warrior creature token.\n[−6]: You get an emblem with ""Whenever you cast an Elf spell, it gains haste until end of turn and you draw two cards."""
KHM,Kaya the Inexorable,mythic,{3}{W}{B},"B, W",Planeswalker,Kaya,0,0,0,0,0,0,0,"[+1]: Put a ghostform counter on up to one target nontoken creature. It gains ""When this creature dies or is put into exile, return it to its owner's hand and create a 1/1 white Spirit creature token with flying.""\n[−3]: Exile target nonland permanent.\n[−7]: You get an emblem with ""At the beginning of your upkeep, you may cast a legendary spell from your hand, from your graveyard, or from among cards you own in exile without paying its mana cost."""
KHM,Niko Aris,mythic,{X}{W}{U}{U},"U, W",Planeswalker,Niko,0,0,0,0,0,0,0,"When Niko Aris enters the battlefield, create X Shard tokens. (They're enchantments with ""{2}, Sacrifice this enchantment: Scry 1, then draw a card."")\n[+1]: Up to one target creature you control can't be blocked this turn. Whenever that creature deals damage this turn, return it to its owner's hand.\n[−1]: Niko Aris deals 2 damage to target tapped creature for each card you've drawn this turn.\n[−1]: Create a Shard token."
KHM,Barkchannel Pathway // Tidechannel Pathway,rare,0,"G, U",Land,0,0,0,0,0,0,0,0,{T}: Add {G}.
KHM,Barkchannel Pathway // Tidechannel Pathway,rare,0,"G, U",Land,0,0,0,0,0,0,0,0,{T}: Add {U}.
KHM,Blightstep Pathway // Searstep Pathway,rare,0,"B, R",Land,0,0,0,0,0,0,0,0,{T}: Add {B}.
KHM,Blightstep Pathway // Searstep Pathway,rare,0,"B, R",Land,0,0,0,0,0,0,0,0,{T}: Add {R}.
KHM,Darkbore Pathway // Slitherbore Pathway,rare,0,"B, G",Land,0,0,0,0,0,0,0,0,{T}: Add {B}.
KHM,Darkbore Pathway // Slitherbore Pathway,rare,0,"B, G",Land,0,0,0,0,0,0,0,0,{T}: Add {G}.
KHM,Hengegate Pathway // Mistgate Pathway,rare,0,"U, W",Land,0,0,0,0,0,0,0,0,{T}: Add {W}.
KHM,Hengegate Pathway // Mistgate Pathway,rare,0,"U, W",Land,0,0,0,0,0,0,0,0,{T}: Add {U}.
KHM,Starnheim Unleashed,mythic,{2}{W}{W},W,Sorcery,0,0,0,0,0,0,0,0,"Create a 4/4 white Angel Warrior creature token with flying and vigilance. If this spell was foretold, create X of those tokens instead.\nForetell {X}{X}{W} (During your turn, you may pay {2} and exile this card from your hand face down. Cast it on a later turn for its foretell cost.)"
KHM,Alrund's Epiphany,mythic,{5}{U}{U},U,Sorcery,0,0,0,0,0,0,0,0,"Create two 1/1 blue Bird creature tokens with flying. Take an extra turn after this one. Exile Alrund's Epiphany.\nForetell {4}{U}{U} (During your turn, you may pay {2} and exile this card from your hand face down. Cast it on a later turn for its foretell cost.)"
KHM,Haunting Voyage,mythic,{4}{B}{B},B,Sorcery,0,0,0,0,0,0,0,0,"Choose a creature type. Return up to two creature cards of that type from your graveyard to the battlefield. If this spell was foretold, return all creature cards of that type from your graveyard to the battlefield instead.\nForetell {5}{B}{B} (During your turn, you may pay {2} and exile this card from your hand face down. Cast it on a later turn for its foretell cost.)"
KHM,Quakebringer,mythic,{3}{R}{R},R,Creature,"Giant, Berserker",5,4,0,0,0,0,0,"Your opponents can't gain life.\nAt the beginning of your upkeep, Quakebringer deals 2 damage to each opponent. This ability triggers only if Quakebringer is on the battlefield or if Quakebringer is in your graveyard and you control a Giant.\nForetell {2}{R}{R}"
KHM,Battle Mammoth,mythic,{3}{G}{G},G,Creature,Elephant,6,5,0,0,0,0,0,"Trample\nWhenever a permanent you control becomes the target of a spell or ability an opponent controls, you may draw a card.\nForetell {2}{G}{G} (During your turn, you may pay {2} and exile this card from your hand face down. Cast it on a later turn for its foretell cost.)"
KHM,"Halvar, God of Battle // Sword of the Realms",mythic,{2}{W}{W},W,Creature,God,4,4,0,0,0,0,0,"Creatures you control that are enchanted or equipped have double strike.\nAt the beginning of each combat, you may attach target Aura or Equipment attached to a creature you control to target creature you control."
KHM,"Halvar, God of Battle // Sword of the Realms",mythic,{1}{W},W,Artifact,Equipment,0,0,0,0,0,0,0,"Equipped creature gets +2/+0 and has vigilance.\nWhenever equipped creature dies, return it to its owner's hand.\nEquip {1}{W}"
KHM,"Reidane, God of the Worthy // Valkmira, Protector's Shield",rare,{2}{W},W,Creature,God,2,3,0,0,0,0,0,"Flying, vigilance\nSnow lands your opponents control enter the battlefield tapped.\nNoncreature spells your opponents cast with mana value 4 or greater cost {2} more to cast."
KHM,"Reidane, God of the Worthy // Valkmira, Protector's Shield",rare,{3}{W},W,Artifact,0,0,0,0,0,0,0,0,"If a source an opponent controls would deal damage to you or a permanent you control, prevent 1 of that damage.\nWhenever you or another permanent you control becomes the target of a spell or ability an opponent controls, counter that spell or ability unless its controller pays {1}."
KHM,"Sigrid, God-Favored",rare,{1}{W}{W},W,Creature,"Human, Warrior",2,2,0,0,0,0,0,"Flash\nFirst strike, protection from God creatures\nWhen Sigrid, God-Favored enters the battlefield, exile up to one target attacking or blocking creature until Sigrid leaves the battlefield."
KHM,"Alrund, God of the Cosmos // Hakka, Whispering Raven",mythic,{3}{U}{U},U,Creature,God,1,1,0,0,0,0,0,"Alrund gets +1/+1 for each card in your hand and each foretold card you own in exile.\nAt the beginning of your end step, choose a card type, then reveal the top two cards of your library. Put all cards of the chosen type revealed this way into your hand and the rest on the bottom of your library in any order."
KHM,"Alrund, God of the Cosmos // Hakka, Whispering Raven",mythic,{1}{U},U,Creature,Bird,2,3,0,0,0,0,0,"Flying\nWhenever Hakka, Whispering Raven deals combat damage to a player, return it to its owner's hand, then scry 2."
KHM,"Cosima, God of the Voyage // The Omenkeel",rare,{2}{U},U,Creature,God,2,4,0,0,0,0,0,"At the beginning of your upkeep, you may exile Cosima. If you do, it gains ""Whenever a land enters the battlefield under your control, if Cosima is exiled, you may put a voyage counter on it. If you don't, return Cosima to the battlefield with X +1/+1 counters on it and draw X cards, where X is the number of voyage counters on it."""
KHM,"Cosima, God of the Voyage // The Omenkeel",rare,{1}{U},U,Artifact,Vehicle,3,3,0,0,0,0,0,"Whenever a Vehicle you control deals combat damage to a player, that player exiles that many cards from the top of their library. You may play lands from among those cards for as long as they remain exiled.\nCrew 1"
KHM,Inga Rune-Eyes,uncommon,{3}{U},U,Creature,"Human, Wizard",3,3,0,0,0,0,0,"When Inga Rune-Eyes enters the battlefield, scry 3.\nWhen Inga Rune-Eyes dies, draw three cards if three or more creatures died this turn."
KHM,"Orvar, the All-Form",mythic,{3}{U},U,Creature,Shapeshifter,3,3,0,0,0,0,0,"Changeling\nWhenever you cast an instant or sorcery spell, if it targets one or more other permanents you control, create a token that's a copy of one of those permanents.\nWhen a spell or ability an opponent controls causes you to discard this card, create a token that's a copy of target permanent."
KHM,"Egon, God of Death // Throne of Death",rare,{2}{B},B,Creature,God,6,6,0,0,0,0,0,"Deathtouch\nAt the beginning of your upkeep, exile two cards from your graveyard. If you can't, sacrifice Egon and draw a card."
KHM,"Egon, God of Death // Throne of Death",rare,{B},B,Artifact,0,0,0,0,0,0,0,0,"At the beginning of your upkeep, mill a card.\n{2}{B}, {T}, Exile a creature card from your graveyard: Draw a card."
KHM,"Tergrid, God of Fright // Tergrid's Lantern",rare,{3}{B}{B},B,Creature,God,4,5,0,0,0,0,0,"Menace\nWhenever an opponent sacrifices a nontoken permanent or discards a permanent card, you may put that card from a graveyard onto the battlefield under your control."
KHM,"Tergrid, God of Fright // Tergrid's Lantern",rare,{3}{B},B,Artifact,0,0,0,0,0,0,0,0,{T}: Target player loses 3 life unless they sacrifice a nonland permanent or discard a card.\n{3}{B}: Untap Tergrid's Lantern.
KHM,"Valki, God of Lies // Tibalt, Cosmic Impostor",mythic,{1}{B},"B, R",Creature,God,2,1,0,0,0,0,0,"When Valki enters the battlefield, each opponent reveals their hand. For each opponent, exile a creature card they revealed this way until Valki leaves the battlefield.\n{X}: Choose a creature card exiled with Valki with mana value X. Valki becomes a copy of that card."
KHM,"Valki, God of Lies // Tibalt, Cosmic Impostor",mythic,{5}{B}{R},"B, R",Planeswalker,Tibalt,0,0,0,0,0,0,0,"As Tibalt enters the battlefield, you get an emblem with ""You may play cards exiled with Tibalt, Cosmic Impostor, and you may spend mana as though it were mana of any color to cast those spells.""\n[+2]: Exile the top card of each player's library.\n[−3]: Exile target artifact or creature.\n[−8]: Exile all graveyards. Add {R}{R}{R}."
KHM,"Varragoth, Bloodsky Sire",rare,{2}{B},B,Creature,"Demon, Rogue",2,3,0,0,0,0,0,"Deathtouch\nBoast — {1}{B}: Target player searches their library for a card, then shuffles and puts that card on top. (Activate only if this creature attacked this turn and only once each turn.)"
KHM,Arni Brokenbrow,rare,{2}{R},R,Creature,"Human, Berserker",3,3,0,0,0,0,0,Haste\nBoast — {1}: You may change Arni Brokenbrow's base power to 1 plus the greatest power among other creatures you control until end of turn. (Activate only if this creature attacked this turn and only once each turn.)
KHM,"Birgi, God of Storytelling // Harnfel, Horn of Bounty",rare,{2}{R},R,Creature,God,3,3,0,0,0,0,0,"Whenever you cast a spell, add {R}. Until end of turn, you don't lose this mana as steps and phases end.\nCreatures you control can boast twice during each of your turns rather than once."
KHM,"Birgi, God of Storytelling // Harnfel, Horn of Bounty",rare,{4}{R},R,Artifact,0,0,0,0,0,0,0,0,Discard a card: Exile the top two cards of your library. You may play those cards this turn.
KHM,"Magda, Brazen Outlaw",rare,{1}{R},R,Creature,"Dwarf, Berserker",2,1,0,0,0,0,0,"Other Dwarves you control get +1/+0.\nWhenever a Dwarf you control becomes tapped, create a Treasure token.\nSacrifice five Treasures: Search your library for an artifact or Dragon card, put that card onto the battlefield, then shuffle."
KHM,"Toralf, God of Fury // Toralf's Hammer",mythic,{2}{R}{R},R,Creature,God,5,4,0,0,0,0,0,"Trample\nWhenever a creature or planeswalker an opponent controls is dealt excess noncombat damage, Toralf deals damage equal to the excess to any target other than that permanent."
KHM,"Toralf, God of Fury // Toralf's Hammer",mythic,{1}{R},R,Artifact,Equipment,0,0,0,0,0,0,0,"Equipped creature has ""{1}{R}, {T}, Unattach Toralf's Hammer: It deals 3 damage to any target. Return Toralf's Hammer to its owner's hand.""\nEquipped creature gets +3/+0 as long as it's legendary.\nEquip {1}{R}"
KHM,"Esika, God of the Tree // The Prismatic Bridge",mythic,{1}{G}{G},"B, G, R, U, W",Creature,God,1,4,0,0,0,0,0,"Vigilance\n{T}: Add one mana of any color.\nOther legendary creatures you control have vigilance and ""{T}: Add one mana of any color."""
KHM,"Esika, God of the Tree // The Prismatic Bridge",mythic,{W}{U}{B}{R}{G},"B, G, R, U, W",Enchantment,0,0,0,0,0,0,0,0,"At the beginning of your upkeep, reveal cards from the top of your library until you reveal a creature or planeswalker card. Put that card onto the battlefield and the rest on the bottom of your library in a random order."
KHM,Esika's Chariot,rare,{3}{G},G,Artifact,Vehicle,4,4,0,0,0,0,0,"When Esika's Chariot enters the battlefield, create two 2/2 green Cat creature tokens.\nWhenever Esika's Chariot attacks, create a token that's a copy of target token you control.\nCrew 4"
KHM,"Fynn, the Fangbearer",uncommon,{1}{G},G,Creature,"Human, Warrior",1,3,0,0,0,0,0,"Deathtouch\nWhenever a creature you control with deathtouch deals combat damage to a player, that player gets two poison counters. (A player with ten or more poison counters loses the game.)"
KHM,"Jorn, God of Winter // Kaldring, the Rimestaff",rare,{2}{G},"B, G, U",Creature,God,3,3,0,0,0,0,0,"Whenever Jorn attacks, untap each snow permanent you control."
KHM,"Jorn, God of Winter // Kaldring, the Rimestaff",rare,{1}{U}{B},"B, G, U",Artifact,0,0,0,0,0,0,0,0,"{T}: You may play target snow permanent card from your graveyard this turn. If you do, it enters the battlefield tapped."
KHM,"Kolvori, God of Kinship // The Ringhart Crest",rare,{2}{G}{G},G,Creature,God,2,4,0,0,0,0,0,"As long as you control three or more legendary creatures, Kolvori gets +4/+2 and has vigilance.\n{1}{G}, {T}: Look at the top six cards of your library. You may reveal a legendary creature card from among them and put it into your hand. Put the rest on the bottom of your library in a random order."
KHM,"Kolvori, God of Kinship // The Ringhart Crest",rare,{1}{G},G,Artifact,0,0,0,0,0,0,0,0,"As The Ringhart Crest enters the battlefield, choose a creature type.\n{T}: Add {G}. Spend this mana only to cast a creature spell of the chosen type or a legendary creature spell."
KHM,"Toski, Bearer of Secrets",rare,{3}{G},G,Creature,Squirrel,1,1,0,0,0,0,0,"This spell can't be countered.\nIndestructible\nToski, Bearer of Secrets attacks each combat if able.\nWhenever a creature you control deals combat damage to a player, draw a card."
KHM,"Vorinclex, Monstrous Raider",mythic,{4}{G}{G},G,Creature,"Phyrexian, Praetor",6,6,0,0,0,0,0,"Trample, haste\nIf you would put one or more counters on a permanent or player, put twice that many of each of those kinds of counters on that permanent or player instead.\nIf an opponent would put one or more counters on a permanent or player, they put half that many of each of those kinds of counters on that permanent or player instead, rounded down."
KHM,"Aegar, the Freezing Flame",uncommon,{1}{U}{R},"R, U",Creature,"Giant, Wizard",3,3,0,0,0,0,0,"Whenever a creature or planeswalker an opponent controls is dealt excess damage, if a Giant, Wizard, or spell you controlled dealt damage to it this turn, draw a card."
KHM,"Firja, Judge of Valor",uncommon,{2}{W}{B}{B},"B, W",Creature,"Angel, Cleric",2,4,0,0,0,0,0,"Flying, lifelink\nWhenever you cast your second spell each turn, look at the top three cards of your library. Put one of them into your hand and the rest into your graveyard."
KHM,"Harald, King of Skemfar",uncommon,{1}{B}{G},"B, G",Creature,"Elf, Warrior",3,2,0,0,0,0,0,"Menace (This creature can't be blocked except by two or more creatures.)\nWhen Harald, King of Skemfar enters the battlefield, look at the top five cards of your library. You may reveal an Elf, Warrior, or Tyvar card from among them and put it into your hand. Put the rest on the bottom of your library in a random order."
KHM,"Kardur, Doomscourge",uncommon,{2}{B}{R},"B, R",Creature,"Demon, Berserker",4,3,0,0,0,0,0,"When Kardur, Doomscourge enters the battlefield, until your next turn, creatures your opponents control attack each combat if able and attack a player other than you if able.\nWhenever an attacking creature dies, each opponent loses 1 life and you gain 1 life."
KHM,"Koll, the Forgemaster",uncommon,{R}{W},"R, W",Creature,"Dwarf, Warrior",2,2,0,0,0,0,0,"Whenever another nontoken creature you control dies, if it was enchanted or equipped, return it to its owner's hand.\nCreature tokens you control that are enchanted or equipped get +1/+1."
KHM,"Koma, Cosmos Serpent",mythic,{3}{G}{G}{U}{U},"G, U",Creature,Serpent,6,6,0,0,0,0,0,"This spell can't be countered.\nAt the beginning of each upkeep, create a 3/3 blue Serpent creature token named Koma's Coil.\nSacrifice another Serpent: Choose one —\n• Tap target permanent. Its activated abilities can't be activated this turn.\n• Koma, Cosmos Serpent gains indestructible until end of turn."
KHM,"Maja, Bretagard Protector",uncommon,{2}{G}{W}{W},"G, W",Creature,"Human, Warrior",2,3,0,0,0,0,0,"Other creatures you control get +1/+1.\nLandfall — Whenever a land enters the battlefield under your control, create a 1/1 white Human Warrior creature token."
KHM,Moritte of the Frost,uncommon,{2}{G}{U}{U},"G, U",Creature,Shapeshifter,0,0,0,0,0,0,0,"Changeling (This card is every creature type.)\nYou may have Moritte of the Frost enter the battlefield as a copy of a permanent you control, except it's legendary and snow in addition to its other types and, if it's a creature, it enters with two additional +1/+1 counters on it and has changeling."
KHM,"Narfi, Betrayer King",uncommon,{3}{U}{B},"B, U",Creature,"Zombie, Wizard",4,3,0,0,0,0,0,"Other snow and Zombie creatures you control get +1/+1.\n{S}{S}{S}: Return Narfi, Betrayer King from your graveyard to the battlefield tapped. ({S} can be paid with one mana from a snow source.)"
KHM,"Sarulf, Realm Eater",rare,{1}{B}{G},"B, G",Creature,Wolf,3,3,0,0,0,0,0,"Whenever a permanent an opponent controls is put into a graveyard from the battlefield, put a +1/+1 counter on Sarulf, Realm Eater.\nAt the beginning of your upkeep, if Sarulf has one or more +1/+1 counters on it, you may remove all of them. If you do, exile each other nonland permanent with mana value less than or equal to the number of counters removed this way."
KHM,"Svella, Ice Shaper",uncommon,{1}{R}{G},"G, R",Creature,"Troll, Warrior",2,4,0,0,0,0,0,"{3}, {T}: Create a colorless snow artifact token named Icy Manalith with ""{T}: Add one mana of any color.""\n{6}{R}{G}, {T}: Look at the top four cards of your library. You may cast a spell from among them without paying its mana cost. Put the rest on the bottom of your library in a random order."
KHM,"Vega, the Watcher",uncommon,{1}{W}{U},"U, W",Creature,"Bird, Spirit",2,2,0,0,0,0,0,"Flying\nWhenever you cast a spell from anywhere other than your hand, draw a card."
KHM,"Vorinclex, Monstrous Raider",mythic,{4}{G}{G},G,Creature,"Phyrexian, Praetor",6,6,0,0,0,0,0,"Trample, haste\nIf you would put one or more counters on a permanent or player, put twice that many of each of those kinds of counters on that permanent or player instead.\nIf an opponent would put one or more counters on a permanent or player, they put half that many of each of those kinds of counters on that permanent or player instead, rounded down."
KHM,Doomskar,rare,{3}{W}{W},W,Sorcery,0,0,0,0,0,0,0,0,"Destroy all creatures.\nForetell {1}{W}{W} (During your turn, you may pay {2} and exile this card from your hand face down. Cast it on a later turn for its foretell cost.)"
KHM,Glorious Protector,rare,{2}{W}{W},W,Creature,"Angel, Cleric",3,4,0,0,0,0,0,"Flash\nFlying\nWhen Glorious Protector enters the battlefield, you may exile any number of non-Angel creatures you control until Glorious Protector leaves the battlefield.\nForetell {2}{W}"
KHM,Rally the Ranks,rare,{1}{W},W,Enchantment,0,0,0,0,0,0,0,0,"As Rally the Ranks enters the battlefield, choose a creature type.\nCreatures you control of the chosen type get +1/+1."
