setCode,name,rarity,manaCost,colorIdentity,types,subtypes,power,toughness,quantity,nm,lp,p,foil,text
KHM,Path to the World Tree,uncommon,{1}{G},"B, G, R, U, W",Enchantment,0,0,0,0,0,0,0,0,"When Path to the World Tree enters the battlefield, search your library for a basic land card, reveal it, put it into your hand, then shuffle.\n{2}{W}{U}{B}{R}{G}, Sacrifice Path to the World Tree: You gain 2 life and draw two cards. Target opponent loses 2 life. Path to the World Tree deals 2 damage to up to one target creature. You create a 2/2 green Bear creature token."
KHM,Ravenous Lindwurm,common,{4}{G}{G},G,Creature,Wurm,6,6,0,0,0,0,0,"When Ravenous Lindwurm enters the battlefield, you gain 4 life."
KHM,Realmwalker,rare,{2}{G},G,Creature,Shapeshifter,2,3,0,0,0,0,0,"Changeling (This card is every creature type.)\nAs Realmwalker enters the battlefield, choose a creature type.\nYou may look at the top card of your library any time.\nYou may cast creature spells of the chosen type from the top of your library."
KHM,Rootless Yew,uncommon,{3}{G}{G},G,Creature,Treefolk,5,4,0,0,0,0,0,"When Rootless Yew dies, search your library for a creature card with power or toughness 6 or greater, reveal it, put it into your hand, then shuffle."
KHM,Roots of Wisdom,common,{1}{G},G,Sorcery,0,0,0,0,0,0,0,0,"Mill three cards, then return a land card or Elf card from your graveyard to your hand. If you can't, draw a card. (To mill a card, put the top card of your library into your graveyard.)"
KHM,Rune of Might,uncommon,{1}{G},G,Enchantment,"Aura, Rune",0,0,0,0,0,0,0,"Enchant permanent\nWhen Rune of Might enters the battlefield, draw a card.\nAs long as enchanted permanent is a creature, it gets +1/+1 and has trample.\nAs long as enchanted permanent is an Equipment, it has ""Equipped creature gets +1/+1 and has trample."""
KHM,Sarulf's Packmate,common,{3}{G},G,Creature,Wolf,3,3,0,0,0,0,0,"When Sarulf's Packmate enters the battlefield, draw a card.\nForetell {1}{G} (During your turn, you may pay {2} and exile this card from your hand face down. Cast it on a later turn for its foretell cost.)"
KHM,Sculptor of Winter,common,{1}{G},G,Creature,"Elf, Rogue",2,2,0,0,0,0,0,{T}: Untap target snow land.
KHM,Snakeskin Veil,common,{G},G,Instant,0,0,0,0,0,0,0,0,Put a +1/+1 counter on target creature you control. It gains hexproof until end of turn.
KHM,Spirit of the Aldergard,uncommon,{3}{G},G,Creature,"Bear, Spirit",0,4,0,0,0,0,0,"When Spirit of the Aldergard enters the battlefield, search your library for a snow land card, reveal it, put it into your hand, then shuffle.\nSpirit of the Aldergard gets +1/+0 for each other snow permanent you control."
KHM,Struggle for Skemfar,common,{3}{G},G,Sorcery,0,0,0,0,0,0,0,0,"Put a +1/+1 counter on target creature you control. Then that creature fights up to one target creature you don't control. (Each deals damage equal to its power to the other.)\nForetell {G} (During your turn, you may pay {2} and exile this card from your hand face down. Cast it on a later turn for its foretell cost.)"
KHM,"Toski, Bearer of Secrets",rare,{3}{G},G,Creature,Squirrel,1,1,0,0,0,0,0,"This spell can't be countered.\nIndestructible\nToski, Bearer of Secrets attacks each combat if able.\nWhenever a creature you control deals combat damage to a player, draw a card."
KHM,Tyvar Kell,mythic,{2}{G}{G},"B, G",Planeswalker,Tyvar,0,0,0,0,0,0,0,"Elves you control have ""{T}: Add {B}.""\n[+1]: Put a +1/+1 counter on up to one target Elf. Untap it. It gains deathtouch until end of turn.\n[0]: Create a 1/1 green Elf Warrior creature token.\n[−6]: You get an emblem with ""Whenever you cast an Elf spell, it gains haste until end of turn and you draw two cards."""
KHM,A-Tyvar Kell,mythic,{2}{G}{G},"B, G",Planeswalker,Tyvar,0,0,0,0,0,0,0,"Elves you control have ""{T}: Add {B}.""\n[+1]: Put two +1/+1 counters on up to one target Elf. Untap it. It gains deathtouch until end of turn.\n[0]: Create a 1/1 green Elf Warrior creature token.\n[−7]: You get an emblem with ""Whenever you cast an Elf spell, it gains haste until end of turn and you draw two cards."""
KHM,"Vorinclex, Monstrous Raider",mythic,{4}{G}{G},G,Creature,"Phyrexian, Praetor",6,6,0,0,0,0,0,"Trample, haste\nIf you would put one or more counters on a permanent or player, put twice that many of each of those kinds of counters on that permanent or player instead.\nIf an opponent would put one or more counters on a permanent or player, they put half that many of each of those kinds of counters on that permanent or player instead, rounded down."
KHM,"Aegar, the Freezing Flame",uncommon,{1}{U}{R},"R, U",Creature,"Giant, Wizard",3,3,0,0,0,0,0,"Whenever a creature or planeswalker an opponent controls is dealt excess damage, if a Giant, Wizard, or spell you controlled dealt damage to it this turn, draw a card."
KHM,Arni Slays the Troll,uncommon,{R}{G},"G, R",Enchantment,Saga,0,0,0,0,0,0,0,"(As this Saga enters and after your draw step, add a lore counter. Sacrifice after III.)\nI — Target creature you control fights up to one target creature you don't control.\nII — Add {R}. Put two +1/+1 counters on up to one target creature you control.\nIII — You gain life equal to the greatest power among creatures you control."
KHM,Ascent of the Worthy,uncommon,{1}{W}{B},"B, W",Enchantment,Saga,0,0,0,0,0,0,0,"(As this Saga enters and after your draw step, add a lore counter. Sacrifice after III.)\nI, II — Choose a creature you control. Until your next turn, all damage that would be dealt to creatures you control is dealt to that creature instead.\nIII — Return target creature card from your graveyard to the battlefield with a flying counter on it. That creature is an Angel Warrior in addition to its other types."
KHM,Battle for Bretagard,rare,{1}{G}{W},"G, W",Enchantment,Saga,0,0,0,0,0,0,0,"(As this Saga enters and after your draw step, add a lore counter. Sacrifice after III.)\nI — Create a 1/1 white Human Warrior creature token.\nII — Create a 1/1 green Elf Warrior creature token.\nIII — Choose any number of artifact tokens and/or creature tokens you control with different names. For each of them, create a token that's a copy of it."
KHM,Battle of Frost and Fire,rare,{3}{U}{R},"R, U",Enchantment,Saga,0,0,0,0,0,0,0,"(As this Saga enters and after your draw step, add a lore counter. Sacrifice after III.)\nI — Battle of Frost and Fire deals 4 damage to each non-Giant creature and each planeswalker.\nII — Scry 3.\nIII — Whenever you cast a spell with mana value 5 or greater this turn, draw two cards, then discard a card."
KHM,The Bears of Littjara,rare,{1}{G}{U},"G, U",Enchantment,Saga,0,0,0,0,0,0,0,"(As this Saga enters and after your draw step, add a lore counter. Sacrifice after III.)\nI — Create a 2/2 blue Shapeshifter creature token with changeling.\nII — Any number of target Shapeshifter creatures you control have base power and toughness 4/4.\nIII — Choose up to one target creature or planeswalker. Each creature with power 4 or greater you control deals damage equal to its power to that permanent."
KHM,Binding the Old Gods,uncommon,{2}{B}{G},"B, G",Enchantment,Saga,0,0,0,0,0,0,0,"(As this Saga enters and after your draw step, add a lore counter. Sacrifice after III.)\nI — Destroy target nonland permanent an opponent controls.\nII — Search your library for a Forest card, put it onto the battlefield tapped, then shuffle.\nIII — Creatures you control gain deathtouch until end of turn."
KHM,The Bloodsky Massacre,rare,{1}{B}{R},"B, R",Enchantment,Saga,0,0,0,0,0,0,0,"(As this Saga enters and after your draw step, add a lore counter. Sacrifice after III.)\nI — Create a 2/3 red Demon Berserker creature token with menace.\nII — Whenever a Berserker attacks this turn, you draw a card and you lose 1 life.\nIII — Add {R} for each Berserker you control. Until end of turn, you don't lose this mana as steps and phases end."
KHM,Fall of the Impostor,uncommon,{1}{G}{W},"G, W",Enchantment,Saga,0,0,0,0,0,0,0,"(As this Saga enters and after your draw step, add a lore counter. Sacrifice after III.)\nI, II — Put a +1/+1 counter on up to one target creature.\nIII — Exile a creature with the greatest power among creatures target opponent controls."
KHM,A-Fall of the Impostor,uncommon,{G}{W},"G, W",Enchantment,Saga,0,0,0,0,0,0,0,"(As this Saga enters and after your draw step, add a lore counter. Sacrifice after III.)\nI, II — Put a +1/+1 counter on up to one target creature.\nIII — Exile a creature with the greatest power among creatures target opponent controls."
KHM,"Firja, Judge of Valor",uncommon,{2}{W}{B}{B},"B, W",Creature,"Angel, Cleric",2,4,0,0,0,0,0,"Flying, lifelink\nWhenever you cast your second spell each turn, look at the top three cards of your library. Put one of them into your hand and the rest into your graveyard."
KHM,Firja's Retribution,rare,{1}{W}{W}{B},"B, W",Enchantment,Saga,0,0,0,0,0,0,0,"(As this Saga enters and after your draw step, add a lore counter. Sacrifice after III.)\nI — Create a 4/4 white Angel Warrior creature token with flying and vigilance.\nII — Until end of turn, Angels you control gain ""{T}: Destroy target creature with power less than this creature's power.""\nIII — Angels you control gain double strike until end of turn."
KHM,Forging the Tyrite Sword,uncommon,{1}{R}{W},"R, W",Enchantment,Saga,0,0,0,0,0,0,0,"(As this Saga enters and after your draw step, add a lore counter. Sacrifice after III.)\nI, II — Create a Treasure token.\nIII — Search your library for a card named Halvar, God of Battle or an Equipment card, reveal it, put it into your hand, then shuffle."
KHM,"Harald, King of Skemfar",uncommon,{1}{B}{G},"B, G",Creature,"Elf, Warrior",3,2,0,0,0,0,0,"Menace (This creature can't be blocked except by two or more creatures.)\nWhen Harald, King of Skemfar enters the battlefield, look at the top five cards of your library. You may reveal an Elf, Warrior, or Tyvar card from among them and put it into your hand. Put the rest on the bottom of your library in a random order."
KHM,"A-Harald, King of Skemfar",uncommon,{1}{B}{G},"B, G",Creature,"Elf, Warrior",3,2,0,0,0,0,0,"Menace (This creature can't be blocked except by two or more creatures.)\nWhen Harald, King of Skemfar enters the battlefield, look at the top seven cards of your library. You may reveal an Elf, Warrior, or Tyvar card from among them and put it into your hand. Put the rest on the bottom of your library in a random order."
KHM,Harald Unites the Elves,rare,{2}{B}{G},"B, G",Enchantment,Saga,0,0,0,0,0,0,0,"(As this Saga enters and after your draw step, add a lore counter. Sacrifice after III.)\nI — Mill three cards. You may put an Elf or Tyvar card from your graveyard onto the battlefield.\nII — Put a +1/+1 counter on each Elf you control.\nIII — Whenever an Elf you control attacks this turn, target creature an opponent controls gets -1/-1 until end of turn."
KHM,A-Harald Unites the Elves,rare,{2}{B}{G},"B, G",Enchantment,Saga,0,0,0,0,0,0,0,"(As this Saga enters and after your draw step, add a lore counter. Sacrifice after III.)\nI — Mill five cards. You may put an Elf or Tyvar card from your graveyard onto the battlefield.\nII — Put a +1/+1 counter on each Elf you control.\nIII — Whenever an Elf you control attacks this turn, target creature an opponent controls gets -1/-1 until end of turn."
KHM,Immersturm Predator,rare,{2}{B}{R},"B, R",Creature,"Vampire, Dragon",3,3,0,0,0,0,0,"Flying\nWhenever Immersturm Predator becomes tapped, exile up to one target card from a graveyard and put a +1/+1 counter on Immersturm Predator.\nSacrifice another creature: Immersturm Predator gains indestructible until end of turn. Tap it."
KHM,Invasion of the Giants,uncommon,{U}{R},"R, U",Enchantment,Saga,0,0,0,0,0,0,0,"(As this Saga enters and after your draw step, add a lore counter. Sacrifice after III.)\nI — Scry 2.\nII — Draw a card. Then you may reveal a Giant card from your hand. When you do, Invasion of the Giants deals 2 damage to target opponent or planeswalker.\nIII — The next Giant spell you cast this turn costs {2} less to cast."
KHM,"Kardur, Doomscourge",uncommon,{2}{B}{R},"B, R",Creature,"Demon, Berserker",4,3,0,0,0,0,0,"When Kardur, Doomscourge enters the battlefield, until your next turn, creatures your opponents control attack each combat if able and attack a player other than you if able.\nWhenever an attacking creature dies, each opponent loses 1 life and you gain 1 life."
KHM,Kardur's Vicious Return,uncommon,{2}{B}{R},"B, R",Enchantment,Saga,0,0,0,0,0,0,0,"(As this Saga enters and after your draw step, add a lore counter. Sacrifice after III.)\nI — You may sacrifice a creature. When you do, Kardur's Vicious Return deals 3 damage to any target.\nII — Each player discards a card.\nIII — Return target creature card from your graveyard to the battlefield. Put a +1/+1 counter on it. It gains haste until your next turn."
KHM,Kaya the Inexorable,mythic,{3}{W}{B},"B, W",Planeswalker,Kaya,0,0,0,0,0,0,0,"[+1]: Put a ghostform counter on up to one target nontoken creature. It gains ""When this creature dies or is put into exile, return it to its owner's hand and create a 1/1 white Spirit creature token with flying.""\n[−3]: Exile target nonland permanent.\n[−7]: You get an emblem with ""At the beginning of your upkeep, you may cast a legendary spell from your hand, from your graveyard, or from among cards you own in exile without paying its mana cost."""
KHM,King Narfi's Betrayal,rare,{1}{U}{B},"B, U",Enchantment,Saga,0,0,0,0,0,0,0,"(As this Saga enters and after your draw step, add a lore counter. Sacrifice after III.)\nI — Each player mills four cards. Then you may exile a creature or planeswalker card from each graveyard.\nII, III — Until end of turn, you may cast spells from among cards exiled with King Narfi's Betrayal, and you may spend mana as though it were mana of any color to cast those spells."
KHM,"Koll, the Forgemaster",uncommon,{R}{W},"R, W",Creature,"Dwarf, Warrior",2,2,0,0,0,0,0,"Whenever another nontoken creature you control dies, if it was enchanted or equipped, return it to its owner's hand.\nCreature tokens you control that are enchanted or equipped get +1/+1."
KHM,"Koma, Cosmos Serpent",mythic,{3}{G}{G}{U}{U},"G, U",Creature,Serpent,6,6,0,0,0,0,0,"This spell can't be countered.\nAt the beginning of each upkeep, create a 3/3 blue Serpent creature token named Koma's Coil.\nSacrifice another Serpent: Choose one —\n• Tap target permanent. Its activated abilities can't be activated this turn.\n• Koma, Cosmos Serpent gains indestructible until end of turn."
KHM,"Maja, Bretagard Protector",uncommon,{2}{G}{W}{W},"G, W",Creature,"Human, Warrior",2,3,0,0,0,0,0,"Other creatures you control get +1/+1.\nLandfall — Whenever a land enters the battlefield under your control, create a 1/1 white Human Warrior creature token."
KHM,Moritte of the Frost,uncommon,{2}{G}{U}{U},"G, U",Creature,Shapeshifter,0,0,0,0,0,0,0,"Changeling (This card is every creature type.)\nYou may have Moritte of the Frost enter the battlefield as a copy of a permanent you control, except it's legendary and snow in addition to its other types and, if it's a creature, it enters with two additional +1/+1 counters on it and has changeling."
KHM,"Narfi, Betrayer King",uncommon,{3}{U}{B},"B, U",Creature,"Zombie, Wizard",4,3,0,0,0,0,0,"Other snow and Zombie creatures you control get +1/+1.\n{S}{S}{S}: Return Narfi, Betrayer King from your graveyard to the battlefield tapped. ({S} can be paid with one mana from a snow source.)"
KHM,"A-Narfi, Betrayer King",uncommon,{2}{U}{B},"B, U",Creature,"Zombie, Wizard",4,3,0,0,0,0,0,"Other snow and Zombie creatures you control get +1/+1.\n{S}{S}{S}: Return Narfi, Betrayer King from your graveyard to the battlefield tapped. ({S} can be paid with one mana from a snow source.)"
KHM,Niko Aris,mythic,{X}{W}{U}{U},"U, W",Planeswalker,Niko,0,0,0,0,0,0,0,"When Niko Aris enters the battlefield, create X Shard tokens. (They're enchantments with ""{2}, Sacrifice this enchantment: Scry 1, then draw a card."")\n[+1]: Up to one target creature you control can't be blocked this turn. Whenever that creature deals damage this turn, return it to its owner's hand.\n[−1]: Niko Aris deals 2 damage to target tapped creature for each card you've drawn this turn.\n[−1]: Create a Shard token."
KHM,Niko Defies Destiny,uncommon,{1}{W}{U},"U, W",Enchantment,Saga,0,0,0,0,0,0,0,"(As this Saga enters and after your draw step, add a lore counter. Sacrifice after III.)\nI — You gain 2 life for each foretold card you own in exile.\nII — Add {W}{U}. Spend this mana only to foretell cards or cast spells that have foretell.\nIII — Return target card with foretell from your graveyard to your hand."
KHM,The Raven's Warning,rare,{1}{W}{U},"U, W",Enchantment,Saga,0,0,0,0,0,0,0,"(As this Saga enters and after your draw step, add a lore counter. Sacrifice after III.)\nI — Create a 1/1 blue Bird creature token with flying. You gain 2 life.\nII — Whenever one or more creatures you control with flying deal combat damage to a player this turn, look at that player's hand and draw a card.\nIII — You may put a card you own from outside the game on top of your library."
KHM,"Sarulf, Realm Eater",rare,{1}{B}{G},"B, G",Creature,Wolf,3,3,0,0,0,0,0,"Whenever a permanent an opponent controls is put into a graveyard from the battlefield, put a +1/+1 counter on Sarulf, Realm Eater.\nAt the beginning of your upkeep, if Sarulf has one or more +1/+1 counters on it, you may remove all of them. If you do, exile each other nonland permanent with mana value less than or equal to the number of counters removed this way."
KHM,Showdown of the Skalds,rare,{2}{R}{W},"R, W",Enchantment,Saga,0,0,0,0,0,0,0,"(As this Saga enters and after your draw step, add a lore counter. Sacrifice after III.)\nI — Exile the top four cards of your library. Until the end of your next turn, you may play those cards.\nII, III — Whenever you cast a spell this turn, put a +1/+1 counter on target creature you control."
KHM,"Svella, Ice Shaper",uncommon,{1}{R}{G},"G, R",Creature,"Troll, Warrior",2,4,0,0,0,0,0,"{3}, {T}: Create a colorless snow artifact token named Icy Manalith with ""{T}: Add one mana of any color.""\n{6}{R}{G}, {T}: Look at the top four cards of your library. You may cast a spell from among them without paying its mana cost. Put the rest on the bottom of your library in a random order."
KHM,The Three Seasons,uncommon,{G}{U},"G, U",Enchantment,Saga,0,0,0,0,0,0,0,"(As this Saga enters and after your draw step, add a lore counter. Sacrifice after III.)\nI — Mill three cards.\nII — Return up to two target snow permanent cards from your graveyard to your hand.\nIII — Choose three cards in each graveyard. Their owners shuffle those cards into their libraries."
KHM,The Trickster-God's Heist,uncommon,{2}{U}{B},"B, U",Enchantment,Saga,0,0,0,0,0,0,0,"(As this Saga enters and after your draw step, add a lore counter. Sacrifice after III.)\nI — You may exchange control of two target creatures.\nII — You may exchange control of two target nonbasic, noncreature permanents that share a card type.\nIII — Target player loses 3 life and you gain 3 life."
KHM,"Vega, the Watcher",uncommon,{1}{W}{U},"U, W",Creature,"Bird, Spirit",2,2,0,0,0,0,0,"Flying\nWhenever you cast a spell from anywhere other than your hand, draw a card."
KHM,"A-Vega, the Watcher",uncommon,{1}{W}{U},"U, W",Creature,"Bird, Spirit",2,2,0,0,0,0,0,"Flying\nWard {2}\nWhenever you cast a spell from anywhere other than your hand, draw a card."
KHM,Waking the Trolls,rare,{4}{R}{G},"G, R",Enchantment,Saga,0,0,0,0,0,0,0,"(As this Saga enters and after your draw step, add a lore counter. Sacrifice after III.)\nI — Destroy target land.\nII — Put target land card from a graveyard onto the battlefield under your control.\nIII — Choose target opponent. If they control fewer lands than you, create a number of 4/4 green Troll Warrior creature tokens with trample equal to the difference."
KHM,Bloodline Pretender,uncommon,{3},0,"Artifact, Creature",Shapeshifter,2,2,0,0,0,0,0,"Changeling (This card is every creature type.)\nAs Bloodline Pretender enters the battlefield, choose a creature type.\nWhenever another creature of the chosen type enters the battlefield under your control, put a +1/+1 counter on Bloodline Pretender."
KHM,Colossal Plow,uncommon,{2},W,Artifact,Vehicle,6,3,0,0,0,0,0,"Whenever Colossal Plow attacks, add {W}{W}{W} and you gain 3 life. Until end of turn, you don't lose this mana as steps and phases end.\nCrew 6 (Tap any number of creatures you control with total power 6 or more: This Vehicle becomes an artifact creature until end of turn.)"
KHM,Cosmos Elixir,rare,{4},0,Artifact,0,0,0,0,0,0,0,0,"At the beginning of your end step, draw a card if your life total is greater than your starting life total. Otherwise, you gain 2 life."
KHM,A-Cosmos Elixir,rare,{4},0,Artifact,0,0,0,0,0,0,0,0,"At the beginning of your end step, draw a card if your life total is greater than your starting life total. Otherwise, you gain 2 life and scry 1."
KHM,Funeral Longboat,common,{2},0,Artifact,Vehicle,3,3,0,0,0,0,0,Vigilance\nCrew 1 (Tap any number of creatures you control with total power 1 or more: This Vehicle becomes an artifact creature until end of turn.)
KHM,Goldvein Pick,common,{2},0,Artifact,Equipment,0,0,0,0,0,0,0,"Equipped creature gets +1/+1.\nWhenever equipped creature deals combat damage to a player, create a Treasure token. (It's an artifact with ""{T}, Sacrifice this artifact: Add one mana of any color."")\nEquip {1} ({1}: Attach to target creature you control. Equip only as a sorcery.)"
KHM,Maskwood Nexus,rare,{4},0,Artifact,0,0,0,0,0,0,0,0,"Creatures you control are every creature type. The same is true for creature spells you control and creature cards you own that aren't on the battlefield.\n{3}, {T}: Create a 2/2 blue Shapeshifter creature token with changeling. (It is every creature type.)"
KHM,Pyre of Heroes,rare,{2},0,Artifact,0,0,0,0,0,0,0,0,"{2}, {T}, Sacrifice a creature: Search your library for a creature card that shares a creature type with the sacrificed creature and has mana value equal to 1 plus that creature's mana value. Put that card onto the battlefield, then shuffle. Activate only as a sorcery."
KHM,Raiders' Karve,common,{3},0,Artifact,Vehicle,4,4,0,0,0,0,0,"Whenever Raiders' Karve attacks, look at the top card of your library. If it's a land card, you may put it onto the battlefield tapped.\nCrew 3 (Tap any number of creatures you control with total power 3 or more: This Vehicle becomes an artifact creature until end of turn.)"
KHM,Raven Wings,common,{2},0,Artifact,Equipment,0,0,0,0,0,0,0,"Equipped creature gets +1/+0, has flying, and is a Bird in addition to its other types.\nEquip {2} ({2}: Attach to target creature you control. Equip only as a sorcery.)"
KHM,Replicating Ring,uncommon,{3},0,Artifact,0,0,0,0,0,0,0,0,"{T}: Add one mana of any color.\nAt the beginning of your upkeep, put a night counter on Replicating Ring. Then if it has eight or more night counters on it, remove all of them and create eight colorless snow artifact tokens named Replicated Ring with ""{T}: Add one mana of any color."""
KHM,Runed Crown,uncommon,{3},0,Artifact,Equipment,0,0,0,0,0,0,0,"When Runed Crown enters the battlefield, you may search your library, hand, and/or graveyard for a Rune card and put it onto the battlefield attached to Runed Crown. If you search your library this way, shuffle.\nEquipped creature gets +1/+1.\nEquip {2}"
KHM,Scorn Effigy,common,{3},0,"Artifact, Creature",Scarecrow,2,3,0,0,0,0,0,"Foretell {0} (During your turn, you may pay {2} and exile this card from your hand face down. Cast it on a later turn for its foretell cost.)"
KHM,Weathered Runestone,uncommon,{2},0,Artifact,0,0,0,0,0,0,0,0,Nonland permanent cards in graveyards and libraries can't enter the battlefield.\nPlayers can't cast spells from graveyards or libraries.
KHM,Alpine Meadow,common,0,"R, W",Land,"Mountain, Plains",0,0,0,0,0,0,0,({T}: Add {R} or {W}.)\nAlpine Meadow enters the battlefield tapped.
KHM,Arctic Treeline,common,0,"G, W",Land,"Forest, Plains",0,0,0,0,0,0,0,({T}: Add {G} or {W}.)\nArctic Treeline enters the battlefield tapped.
KHM,Axgard Armory,uncommon,0,"R, W",Land,0,0,0,0,0,0,0,0,"Axgard Armory enters the battlefield tapped.\n{T}: Add {W}.\n{1}{R}{R}{W}, {T}, Sacrifice Axgard Armory: Search your library for an Aura card and/or an Equipment card, reveal them, put them into your hand, then shuffle."
KHM,Barkchannel Pathway // Tidechannel Pathway,rare,0,"G, U",Land,0,0,0,0,0,0,0,0,{T}: Add {G}.
KHM,Barkchannel Pathway // Tidechannel Pathway,rare,0,"G, U",Land,0,0,0,0,0,0,0,0,{T}: Add {U}.
KHM,Blightstep Pathway // Searstep Pathway,rare,0,"B, R",Land,0,0,0,0,0,0,0,0,{T}: Add {B}.
KHM,Blightstep Pathway // Searstep Pathway,rare,0,"B, R",Land,0,0,0,0,0,0,0,0,{T}: Add {R}.
KHM,Bretagard Stronghold,uncommon,0,"G, W",Land,0,0,0,0,0,0,0,0,"Bretagard Stronghold enters the battlefield tapped.\n{T}: Add {G}.\n{G}{W}{W}, {T}, Sacrifice Bretagard Stronghold: Put a +1/+1 counter on each of up to two target creatures you control. They gain vigilance and lifelink until end of turn. Activate only as a sorcery."
KHM,A-Bretagard Stronghold,uncommon,0,"G, W",Land,0,0,0,0,0,0,0,0,"Bretagard Stronghold enters the battlefield tapped.\n{T}: Add {G}.\n{G}{W}{W}, {T}, Sacrifice Bretagard Stronghold: Distribute two +1/+1 counters among one or two target creatures you control. They gain vigilance and lifelink until end of turn. Activate only as a sorcery."
KHM,Darkbore Pathway // Slitherbore Pathway,rare,0,"B, G",Land,0,0,0,0,0,0,0,0,{T}: Add {B}.
KHM,Darkbore Pathway // Slitherbore Pathway,rare,0,"B, G",Land,0,0,0,0,0,0,0,0,{T}: Add {G}.
